{
  "bookSpecVersion": 1,
  "id": "book-sample",
  "metadata": {
    "title": "از ایده تا کتاب آموزشی",
    "subtitle": "نمونهٔ سه‌فصلی برای آزمون موتور تولید کتاب",
    "author": "گروه پروژهٔ موتور کتاب",
    "audience": "مؤلفان و طراحان آموزش",
    "description": "این کتاب کوتاه، محتوای تألیفی آزمایشی است. هدف آن بررسی اتصال منابع و فیش‌ها به فصل، ویرایش بلوک‌های محتوا و تولید خروجی مستقل است. این نسخه ادعای پژوهشی یا تأیید علمی بیرونی ندارد.",
    "format": "textbook",
    "versionLabel": "۰.۱"
  },
  "sources": [
    {
      "id": "source-demo",
      "title": "یادداشت تألیفی نمونه برای آزمون موتور",
      "creator": "گروه پروژهٔ موتور کتاب",
      "year": "",
      "locator": "سه بند تألیفی؛ منبع داخلی آزمایشی",
      "url": "",
      "verified": true,
      "excerpt": "بند ۱: کتاب آموزشی با شناخت مخاطب و تعریف کاری که پس از مطالعه می‌تواند انجام دهد آغاز می‌شود.\nبند ۲: هر فصل می‌تواند یک هدف روشن، توضیح، مثال و تمرین مرتبط داشته باشد.\nبند ۳: پیش‌نویس باید پیش از انتشار از نظر محتوا، ارجاع و خوانایی بازبینی شود."
    }
  ],
  "fiches": [
    {
      "id": "fiche-audience",
      "sourceId": "source-demo",
      "kind": "quote",
      "text": "کتاب آموزشی با شناخت مخاطب و تعریف کاری که پس از مطالعه می‌تواند انجام دهد آغاز می‌شود.",
      "locator": "بند ۱",
      "keywords": "مخاطب، هدف یادگیری"
    },
    {
      "id": "fiche-chapter",
      "sourceId": "source-demo",
      "kind": "summary",
      "text": "فصل را حول یک هدف، توضیح، مثال و تمرین سازمان‌دهی کنیم.",
      "locator": "بند ۲",
      "keywords": "فصل، تمرین، معماری"
    },
    {
      "id": "fiche-review",
      "sourceId": "source-demo",
      "kind": "summary",
      "text": "بازبینی محتوا و ارجاع‌ها باید پیش از انتشار انجام شود.",
      "locator": "بند ۳",
      "keywords": "ویرایش، ارجاع، انتشار"
    }
  ],
  "chapters": [
    {
      "id": "chapter-audience",
      "title": "مخاطب و وعدهٔ یادگیری",
      "objectives": [
        "مخاطب اصلی کتاب خود را توصیف کنید.",
        "یک هدف قابل مشاهده برای کتاب بنویسید."
      ],
      "fichIds": [
        "fiche-audience"
      ],
      "blocks": [
        {
          "id": "block-306026c3-a815-4891-9393-813c1d8a8f4f",
          "type": "paragraph",
          "text": "پیش از نوشتن فصل اول، مشخص کنید کتاب برای چه کسی نوشته می‌شود. خواننده چه تجربه‌ای دارد، با چه مسئله‌ای روبه‌رو است و قرار است پس از مطالعه چه کاری انجام دهد؟ پاسخ به این پرسش‌ها به انتخاب واژه‌ها، مثال‌ها و تمرین‌ها جهت می‌دهد.",
          "sourceId": null,
          "locator": "",
          "rubric": "",
          "items": [],
          "lines": 4
        },
        {
          "id": "block-278ff096-b6b8-46a4-81ef-35287ed493be",
          "type": "quote",
          "text": "کتاب آموزشی با شناخت مخاطب و تعریف کاری که پس از مطالعه می‌تواند انجام دهد آغاز می‌شود.",
          "sourceId": "source-demo",
          "locator": "بند ۱",
          "rubric": "",
          "items": [],
          "lines": 4
        },
        {
          "id": "block-511c6fed-e565-4e60-9db2-846602354691",
          "type": "heading",
          "text": "از موضوع کلی به یک هدف روشن",
          "sourceId": null,
          "locator": "",
          "rubric": "",
          "items": [],
          "lines": 4
        },
        {
          "id": "block-5c984a8f-ab82-4924-bf14-9fa99af474c0",
          "type": "paragraph",
          "text": "«آشنایی با نوشتن» عنوانی کلی است. می‌توان آن را به هدفی روشن‌تر تبدیل کرد: خواننده بتواند برای کتاب خود یک فهرست سه‌فصلی تهیه کند و دلیل ترتیب فصل‌ها را توضیح دهد. چنین هدفی انتخاب محتوا و طراحی تمرین را آسان‌تر می‌کند.",
          "sourceId": null,
          "locator": "",
          "rubric": "",
          "items": [],
          "lines": 4
        },
        {
          "id": "block-fe429ccd-fcab-4bc0-8269-9ea8881bca77",
          "type": "callout",
          "text": "مثال فرضی: مخاطب یک راهنمای کارگاهی، مربی تازه‌کار است. او پیش از بحث نظری طولانی، به نمونهٔ اجرای فعالیت و پرسش‌های پیشنهادی نیاز دارد.",
          "sourceId": null,
          "locator": "",
          "rubric": "",
          "items": [],
          "lines": 4
        },
        {
          "id": "block-f28feb56-bd57-4ad1-ab25-1595addfc2f8",
          "type": "exercise",
          "text": "مخاطب کتاب خود را در سه جمله توصیف کنید. سپس بنویسید او پس از مطالعه چه محصول یا تصمیمی باید بتواند ارائه کند.",
          "sourceId": null,
          "locator": "",
          "rubric": "مخاطب مشخص باشد؛ هدف با یک کار قابل مشاهده بیان شود.",
          "items": [],
          "lines": 4
        }
      ]
    },
    {
      "id": "chapter-structure",
      "title": "از فیش تا فصل منسجم",
      "objectives": [
        "برای یک فصل، مسیر توضیح تا تمرین طراحی کنید.",
        "هر ادعای برگرفته از منبع را به فیش مربوط پیوند دهید."
      ],
      "fichIds": [
        "fiche-chapter"
      ],
      "blocks": [
        {
          "id": "block-169407d5-213d-496a-aab1-6c82106b1f74",
          "type": "paragraph",
          "text": "فیش‌ها مواد اولیهٔ نگارش‌اند. پیش از تبدیل آن‌ها به متن، مشخص کنید هر فیش به کدام پرسش فصل پاسخ می‌دهد. فیش نامرتبط را کنار بگذارید و شکاف‌های محتوا را ثبت کنید. داشتن فیش بیشتر، به‌تنهایی فصل منسجم ایجاد نمی‌کند.",
          "sourceId": null,
          "locator": "",
          "rubric": "",
          "items": [],
          "lines": 4
        },
        {
          "id": "block-ed9f3a9d-0184-405a-b588-c73940fcd1ab",
          "type": "heading",
          "text": "یک الگوی ساده برای فصل",
          "sourceId": null,
          "locator": "",
          "rubric": "",
          "items": [],
          "lines": 4
        },
        {
          "id": "block-20375979-3461-4835-ba21-339cf8f909ac",
          "type": "list",
          "text": "",
          "sourceId": null,
          "locator": "",
          "rubric": "",
          "items": [
            "با مسئله یا پرسش خواننده آغاز کنید.",
            "مفهوم اصلی را با واژه‌های مناسب مخاطب توضیح دهید.",
            "یک مثال روشن و یک تمرین مرتبط ارائه کنید.",
            "در پایان، نکته‌های اصلی و راه ادامه را جمع‌بندی کنید."
          ],
          "lines": 4
        },
        {
          "id": "block-ff4bdbdc-0aa7-4f55-9c85-bba82fc377d1",
          "type": "paragraph",
          "text": "در این موتور، هر بخش به‌صورت یک بلوک ذخیره می‌شود. می‌توان متن، تیتر، نکته، فهرست، نقل‌قول و تمرین را جداگانه ویرایش یا جابه‌جا کرد. تغییر قالب کتاب، محتوای اصلی فصل را حفظ می‌کند و شیوهٔ نمایش تمرین‌ها را تغییر می‌دهد.",
          "sourceId": null,
          "locator": "",
          "rubric": "",
          "items": [],
          "lines": 4
        },
        {
          "id": "block-d91e04a4-976b-4832-939f-298829323f34",
          "type": "callout",
          "text": "مثال فرضی: یک تمرین در درس‌نامه با پرسش و معیار بررسی نمایش داده می‌شود. همان تمرین در کتاب کار، فضای نوشتن پاسخ نیز دارد.",
          "sourceId": null,
          "locator": "",
          "rubric": "",
          "items": [],
          "lines": 4
        },
        {
          "id": "block-300b20a6-347e-4123-996a-f87162b9b7d9",
          "type": "exercise",
          "text": "برای یک موضوع دلخواه، چهار بلوک پیشنهاد کنید: توضیح، مثال، تمرین و جمع‌بندی. بنویسید هر بلوک از کدام فیش یا تجربهٔ تألیفی استفاده می‌کند.",
          "sourceId": null,
          "locator": "",
          "rubric": "همهٔ بلوک‌ها به هدف واحد فصل کمک کنند؛ منبع و برداشت مؤلف از هم مشخص باشند.",
          "items": [],
          "lines": 5
        }
      ]
    },
    {
      "id": "chapter-review",
      "title": "بازبینی و خروجی قابل تحویل",
      "objectives": [
        "متن فصل را با یک چک‌لیست کوتاه بررسی کنید.",
        "تفاوت فایل پروژه، خروجی وب و نسخهٔ چاپی را توضیح دهید."
      ],
      "fichIds": [
        "fiche-review"
      ],
      "blocks": [
        {
          "id": "block-4585c9a9-b14c-499f-9443-13607599aeff",
          "type": "paragraph",
          "text": "پیش‌نویس پایان کار نیست. متن را از نظر پاسخ‌دادن به هدف فصل، ترتیب بخش‌ها و دقت ارجاع‌ها بررسی کنید. سپس جمله‌ها را برای خوانایی و یکدستی زبان بازنویسی کنید. در آخر، خروجی صفحه‌آرایی را جداگانه ببینید؛ خوانایی داده‌های ذخیره‌شده، تضمین‌کنندهٔ چیدمان مناسب صفحه نیست.",
          "sourceId": null,
          "locator": "",
          "rubric": "",
          "items": [],
          "lines": 4
        },
        {
          "id": "block-ffc3bfb5-a96c-4b92-841f-67d3d2552ebf",
          "type": "heading",
          "text": "سه خروجی با سه کاربرد",
          "sourceId": null,
          "locator": "",
          "rubric": "",
          "items": [],
          "lines": 4
        },
        {
          "id": "block-edf3c12c-db50-4ce9-aaf1-fd7e232a06e7",
          "type": "list",
          "text": "",
          "sourceId": null,
          "locator": "",
          "rubric": "",
          "items": [
            "فایل پروژهٔ JSON: شناسنامه، منابع، فیش‌ها، فصل‌ها و یادداشت‌های مسیر را برای ویرایش بعدی نگه می‌دارد.",
            "کتاب HTML: یک خروجی مستقل برای مطالعه در مرورگر است.",
            "چاپ یا PDF: نسخهٔ صفحه‌بندی‌شدهٔ خود کتاب برای بازبینی یا تحویل است."
          ],
          "lines": 4
        },
        {
          "id": "block-45856a2d-b8b6-4557-a624-d5985f607a0c",
          "type": "callout",
          "text": "این نمونه فقط برای آزمون نرم‌افزار نوشته شده است. «بررسی‌شده» بودن منبع داخلی یعنی تطبیق با یادداشت همین نمونه ثبت شده؛ تأیید علمی بیرونی محسوب نمی‌شود.",
          "sourceId": null,
          "locator": "",
          "rubric": "",
          "items": [],
          "lines": 4
        },
        {
          "id": "block-6e9945f7-c0a6-431d-a7e4-64a77e5d19ae",
          "type": "exercise",
          "text": "یک فصل را انتخاب کنید. هدف آن، ارتباط تمرین با هدف، نشانی نقل‌قول‌ها و خوانایی خروجی را بررسی کنید. دست‌کم یک اصلاح را ثبت و خروجی تازه بگیرید.",
          "sourceId": null,
          "locator": "",
          "rubric": "اصلاح مشخص باشد؛ بتوان تفاوت نسخهٔ پیش و پس از اصلاح را توضیح داد.",
          "items": [],
          "lines": 4
        }
      ]
    }
  ]
}