{
  "bookSpecVersion": 1,
  "id": "book-ai-authoring-test",
  "metadata": {
    "title": "از محتوای آموزشی تا کتاب کاربردی",
    "subtitle": "نمونهٔ تولید کتاب با قرارداد BOOK و موتور ثابت",
    "author": "پیش‌نویس آزمایشی AI، برای بازبینی مؤلف",
    "audience": "معلمان و طراحان محتوای آموزشی",
    "description": "این نمونه با استفاده از سه بخش فایل آموزشی ارائه‌شده ساخته شده است. تمرین‌ها و مثال‌ها پیشنهاد تألیفی هستند و برای نشان‌دادن مسیر تولید کل کتاب با موتور به کار می‌روند.",
    "format": "workbook",
    "versionLabel": "۰.۲"
  },
  "sources": [
    {
      "id": "source-academy",
      "title": "آکادمی هوشمند کتاب‌نویسی؛ فایل تولید کتاب.html",
      "creator": "",
      "year": "",
      "locator": "گام‌های ۴، ۵ و ۱۶؛ آموزش مفهومی",
      "url": "",
      "excerpt": "گام 4، اصل 1: قبل از نگارش، کتاب را برای یک خواننده مشخص تعریف کنید: چه مشکلی دارد، در پایان چه کاری می‌تواند انجام دهد و این کتاب چه تفاوتی با منابع دیگر دارد؟\nگام 5، اصل 2: برای هر فصل، پرسش کلیدی، اهداف یادگیری، زیرعنوان‌ها، نمونه، تمرین و پیوند آن با فصل قبل و بعد را طراحی کنید. همپوشانی‌ها را شناسایی و رفع کنید.\nگام 16، اصل 1: نمونه‌خوانی پس از صفحه‌آرایی انجام می‌شود؛ خطاهای املایی، سرصفحه، شماره صفحه، ارجاع، جدول، کپشن و شکست سطر ممکن است در صفحه نهایی آشکار شوند.",
      "verified": false
    }
  ],
  "fiches": [
    {
      "id": "fiche-reader",
      "sourceId": "source-academy",
      "kind": "quote",
      "text": "قبل از نگارش، کتاب را برای یک خواننده مشخص تعریف کنید: چه مشکلی دارد، در پایان چه کاری می‌تواند انجام دهد و این کتاب چه تفاوتی با منابع دیگر دارد؟",
      "locator": "گام 4، اصل 1",
      "keywords": "مخاطب، هدف"
    },
    {
      "id": "fiche-outline",
      "sourceId": "source-academy",
      "kind": "quote",
      "text": "برای هر فصل، پرسش کلیدی، اهداف یادگیری، زیرعنوان‌ها، نمونه، تمرین و پیوند آن با فصل قبل و بعد را طراحی کنید. همپوشانی‌ها را شناسایی و رفع کنید.",
      "locator": "گام 5، اصل 2",
      "keywords": "فهرست، تمرین"
    },
    {
      "id": "fiche-proof",
      "sourceId": "source-academy",
      "kind": "quote",
      "text": "نمونه‌خوانی پس از صفحه‌آرایی انجام می‌شود؛ خطاهای املایی، سرصفحه، شماره صفحه، ارجاع، جدول، کپشن و شکست سطر ممکن است در صفحه نهایی آشکار شوند.",
      "locator": "گام 16، اصل 1",
      "keywords": "نمونه‌خوانی، خروجی"
    }
  ],
  "chapters": [
    {
      "id": "chapter-reader",
      "title": "کتاب را برای یک خواننده تعریف کنیم",
      "objectives": [
        "مخاطب اصلی را به‌صورت مشخص توصیف کنید.",
        "یک هدف قابل مشاهده برای کتاب بنویسید."
      ],
      "fichIds": [
        "fiche-reader"
      ],
      "blocks": [
        {
          "id": "reader-intro",
          "type": "paragraph",
          "text": "وقتی مجموعه‌ای از یادداشت‌ها در اختیار داریم، نقطهٔ شروع تألیف می‌تواند تعیین خواننده باشد. یک کتاب برای همهٔ مخاطبان، لزوماً پاسخ روشنی به نیاز هیچ گروهی نمی‌دهد. در شناسنامه، تجربهٔ پیشین خواننده، مسئلهٔ او و کاری را که می‌خواهیم پس از مطالعه انجام دهد ثبت می‌کنیم."
        },
        {
          "id": "reader-quote",
          "type": "quote",
          "text": "قبل از نگارش، کتاب را برای یک خواننده مشخص تعریف کنید: چه مشکلی دارد، در پایان چه کاری می‌تواند انجام دهد و این کتاب چه تفاوتی با منابع دیگر دارد؟",
          "sourceId": "source-academy",
          "locator": "گام ۴، اصل ۱"
        },
        {
          "id": "reader-heading",
          "type": "heading",
          "text": "هدف را به یک کار تبدیل کنیم"
        },
        {
          "id": "reader-example",
          "type": "callout",
          "text": "مثال فرضی: به‌جای «آشنایی با طراحی درس»، هدف را این‌طور بنویسیم: معلم بتواند برای یک جلسه، هدف، فعالیت و معیار بررسی هماهنگ طراحی کند. این مثال، گزارش نتیجهٔ یک پژوهش یا کارگاه واقعی نیست."
        },
        {
          "id": "reader-body",
          "type": "paragraph",
          "text": "حدود کتاب را هم مشخص کنید. اگر موضوع، طراحی یک جلسهٔ آموزشی است، شرح همهٔ نظریه‌های یادگیری ممکن است تمرکز کتاب را از دسترس خارج کند. عنوان موقت، مخاطب، هدف و حدود محتوا را در شناسنامه وارد کنید و هنگام بازبینی فصل‌ها به همین تصمیم‌ها برگردید."
        },
        {
          "id": "reader-exercise",
          "type": "exercise",
          "text": "مخاطب کتاب خود را در دو جمله توصیف کنید. سپس یک کار مشخص بنویسید که او پس از مطالعهٔ کتاب بتواند انجام دهد.",
          "rubric": "مخاطب محدود و روشن باشد؛ هدف با فعل قابل مشاهده بیان شود.",
          "lines": 5
        }
      ]
    },
    {
      "id": "chapter-outline",
      "title": "از منابع و فیش‌ها به نقشهٔ فصل برسیم",
      "objectives": [
        "فیش‌ها را به پرسش‌های فصل وصل کنید.",
        "یک فصل با توضیح، مثال و تمرین طراحی کنید."
      ],
      "fichIds": [
        "fiche-outline"
      ],
      "blocks": [
        {
          "id": "outline-intro",
          "type": "paragraph",
          "text": "فیش، یک واحد کوچک از محتوا با نشانی منبع است. هنگام نوشتن فصل، از فیش‌هایی استفاده کنید که به پرسش همان فصل پاسخ می‌دهند. نقل‌قول، خلاصه و برداشت مؤلف را از هم جدا نگه دارید؛ نشانی بند یا صفحه را از خود منبع ثبت کنید."
        },
        {
          "id": "outline-quote",
          "type": "quote",
          "text": "برای هر فصل، پرسش کلیدی، اهداف یادگیری، زیرعنوان‌ها، نمونه، تمرین و پیوند آن با فصل قبل و بعد را طراحی کنید. همپوشانی‌ها را شناسایی و رفع کنید.",
          "sourceId": "source-academy",
          "locator": "گام ۵، اصل ۲"
        },
        {
          "id": "outline-list",
          "type": "list",
          "items": [
            "پرسش فصل را بنویسید و هدف آن را مشخص کنید.",
            "فیش‌های مرتبط را انتخاب و به فصل متصل کنید.",
            "توضیح، مثال و تمرین را در بلوک‌های جدا بنویسید.",
            "ترتیب بلوک‌ها را با مسیر یادگیری خواننده تطبیق دهید."
          ]
        },
        {
          "id": "outline-example",
          "type": "callout",
          "text": "مثال فرضی: یک فصل دربارهٔ «هدف یادگیری» می‌تواند از یک هدف مبهم آغاز شود، ویژگی هدف روشن را توضیح دهد، یک بازنویسی نمونه نشان دهد و در پایان تمرین بازنویسی بدهد."
        },
        {
          "id": "outline-exercise",
          "type": "exercise",
          "text": "برای یک فصل، پرسش اصلی، دو هدف و چهار بلوک محتوا پیشنهاد کنید. کنار هر بلوک بنویسید از منبع استفاده می‌کند یا پیشنهاد تألیفی شماست.",
          "rubric": "هدف‌ها، مثال و تمرین به یک مسئلهٔ مشترک مربوط باشند؛ منبع و برداشت مؤلف مشخص باشند.",
          "lines": 6
        }
      ]
    },
    {
      "id": "chapter-review",
      "title": "پیش‌نویس را بررسی و تحویل کنیم",
      "objectives": [
        "خطاهای متن و خروجی صفحه را جداگانه بررسی کنید.",
        "پروژهٔ قابل ویرایش و کتاب قابل مطالعه را تحویل دهید."
      ],
      "fichIds": [
        "fiche-proof"
      ],
      "blocks": [
        {
          "id": "review-intro",
          "type": "paragraph",
          "text": "بعد از نگارش، ابتدا ارتباط هر فصل با هدف کتاب را بررسی کنید. سپس ارجاع‌ها، نقل‌قول‌ها و واژه‌های تکرارشونده را تطبیق دهید. در مرحلهٔ بعد، خروجی موتور را باز کنید؛ خطای چیدمان ممکن است در دادهٔ متن دیده نشود."
        },
        {
          "id": "review-quote",
          "type": "quote",
          "text": "نمونه‌خوانی پس از صفحه‌آرایی انجام می‌شود؛ خطاهای املایی، سرصفحه، شماره صفحه، ارجاع، جدول، کپشن و شکست سطر ممکن است در صفحه نهایی آشکار شوند.",
          "sourceId": "source-academy",
          "locator": "گام ۱۶، اصل ۱"
        },
        {
          "id": "review-list",
          "type": "list",
          "items": [
            "متن نقل‌قول را با گزیده و نشانی منبع تطبیق دهید.",
            "قالب کتاب را انتخاب و فضای تمرین‌ها را بررسی کنید.",
            "فایل BOOK.json یا پشتیبان پروژه را برای ادامهٔ ویرایش نگه دارید.",
            "HTML کتاب را برای مطالعه تحویل دهید و برای PDF خود کتاب را چاپ کنید."
          ]
        },
        {
          "id": "review-limit",
          "type": "callout",
          "text": "منبع این نمونه هنوز توسط مؤلف تأیید نشده است. موتور اتصال ارجاع‌ها و تطبیق اولیهٔ نقل‌قول را بررسی می‌کند؛ داوری علمی و تأیید انتشار باید جداگانه انجام شود."
        },
        {
          "id": "review-exercise",
          "type": "exercise",
          "text": "یک فصل را بازبینی کنید. یک ایراد محتوایی و یک نکتهٔ چیدمان ثبت کنید، اصلاح را انجام دهید و خروجی تازه را با نسخهٔ پیشین مقایسه کنید.",
          "rubric": "ایراد و اصلاح مشخص باشند؛ بررسی واقعاً روی متن و خروجی انجام شده باشد.",
          "lines": 5
        }
      ]
    }
  ]
}